,CDSCode,District,School_x,Zip,WebSite,EILName,Latitude,Longitude,LastUpDate,Address,Zipcode,"School, District",AggregateLevel,CountyName,DistrictName,School_y,ReportingCategory,CumulativeEnrollment
439,37683386112478,San Diego Unified,Nye Elementary,92114-6574,,Elementary,32.696055,-117.07013,2020-08-13,"981 Valencia Parkway,San Diego,CA,92114",92114,"Nye Elementary, San Diego Unified",S,San Diego,San Diego Unified,Nye Elementary,TA,420.0
440,37683386112726,San Diego Unified,Dingeman Elementary,92131-3701,http://www.dingeman.net,Elementary,32.933134,-117.0907,2020-08-13,"11840 Scripps Creek Drive,San Diego,CA,92131",92131,"Dingeman Elementary, San Diego Unified",S,San Diego,San Diego Unified,Dingeman Elementary,TA,766.0
441,37683386114060,San Diego Unified,Clark Middle,92105-4238,http://www.monroeclark.org,Intermediate/Middle/Junior High,32.740317,-117.10004,2019-02-13,"4388 Thorn Street,San Diego,CA,92105",92105,"Clark Middle, San Diego Unified",S,San Diego,San Diego Unified,Clark Middle,TA,1430.0
442,37683386114292,San Diego Unified,Kimbrough Elementary,92102-3132,,Elementary,32.708732,-117.13288,2020-07-02,"321 Hoitt Street,San Diego,CA,92102",92102,"Kimbrough Elementary, San Diego Unified",S,San Diego,San Diego Unified,Kimbrough Elementary,TA,447.0
443,37683386114300,San Diego Unified,Chavez Elementary,92113-4037,http://new.sandi.net/schools/chavez,Elementary,32.691605,-117.10807,2020-07-02,"1404 South 40th Street,San Diego,CA,92113",92113,"Chavez Elementary, San Diego Unified",S,San Diego,San Diego Unified,Chavez Elementary,TA,529.0
444,37683386114375,San Diego Unified,Rosa Parks Elementary,92105-2822,http://parks.sandi.net,Elementary,32.745833,-117.09748,2020-07-02,"4510 Landis Street,San Diego,CA,92105",92105,"Rosa Parks Elementary, San Diego Unified",S,San Diego,San Diego Unified,Rosa Parks Elementary,TA,1201.0
445,37683386115331,San Diego Unified,Marshall Middle,92131-2135,http://marshallmiddle.org,Intermediate/Middle/Junior High,32.896523,-117.10011,2020-08-13,"9700 Avenue of Nations,San Diego,CA,92131",92131,"Marshall Middle, San Diego Unified",S,San Diego,San Diego Unified,Marshall Middle,TA,1517.0
446,37683386119135,San Diego Unified,Scripps Elementary,92131-3743,,Elementary,32.930673,-117.08174,2020-08-13,"11778 Cypress Canyon Road,San Diego,CA,92131",92131,"Scripps Elementary, San Diego Unified",S,San Diego,San Diego Unified,Scripps Elementary,TA,755.0
447,37683460106328,San Dieguito Union High,Canyon Crest Academy,92130-2499,http://www.sduhsd.net,High School,32.96024,-117.18835,2020-08-13,"5951 Village Center Loop Road,San Diego,CA,92130",92130,"Canyon Crest Academy, San Dieguito Union High",S,San Diego,San Dieguito Union High,Canyon Crest Academy,TA,2578.0
448,37683460131649,San Dieguito Union High,Pacific Trails Middle,92130-2499,http://www.sduhsd.net/our-schools/pacific-trails-middle-school/index.html,Intermediate/Middle/Junior High,32.958864,-117.18624,2020-08-13,"5975 Village Center Loop Road,San Diego,CA,92130",92130,"Pacific Trails Middle, San Dieguito Union High",S,San Diego,San Dieguito Union High,Pacific Trails Middle,TA,749.0
449,37683463730033,San Dieguito Union High,Torrey Pines High,92130-1316,http://www.sduhsd.net/tp,High School,32.956384,-117.22497,2020-08-13,"3710 Del Mar Heights Road,San Diego,CA,92130",92130,"Torrey Pines High, San Dieguito Union High",S,San Diego,San Dieguito Union High,Torrey Pines High,TA,2509.0
450,37683463731007,San Dieguito Union High,La Costa Canyon High,92009,,High School,33.075076,-117.23236,2020-08-13,"1 Maverick Way,Encinitas,CA,92009",92009,"La Costa Canyon High, San Dieguito Union High",S,San Diego,San Dieguito Union High,La Costa Canyon High,TA,2030.0
451,37683463737384,San Dieguito Union High,Sunset High (Continuation),92024-3703,,High School,33.043504,-117.27747,2019-02-13,"684 Requeza Street,Encinitas,CA,92024",92024,"Sunset High (Continuation), San Dieguito Union High",S,San Diego,San Dieguito Union High,Sunset High (Continuation),TA,204.0
452,37683463737418,San Dieguito Union High,San Dieguito HS Academy,92024-3357,,High School,33.036329,-117.27501,2019-02-13,"800 Santa Fe Drive,Encinitas,CA,92024",92024,"San Dieguito HS Academy, San Dieguito Union High",S,San Diego,San Dieguito Union High,San Dieguito HS Academy,TA,1862.0
453,37683466059737,San Dieguito Union High,Oak Crest Middle,92024-3996,,Intermediate/Middle/Junior High,33.042141,-117.26833,2020-08-13,"675 Balour Drive,Encinitas,CA,92024",92024,"Oak Crest Middle, San Dieguito Union High",S,San Diego,San Dieguito Union High,Oak Crest Middle,TA,764.0
454,37683466061998,San Dieguito Union High,Earl Warren Middle,92075-2038,,Intermediate/Middle/Junior High,32.995158,-117.26242,2020-08-13,"155 Stevens Street,Solana Beach,CA,92075",92075,"Earl Warren Middle, San Dieguito Union High",S,San Diego,San Dieguito Union High,Earl Warren Middle,TA,668.0
455,37683466104749,San Dieguito Union High,Diegueno Middle,92024-5400,,Intermediate/Middle/Junior High,33.056629,-117.24202,2019-02-13,"2150 Village Park Way,Encinitas,CA,92024",92024,"Diegueno Middle, San Dieguito Union High",S,San Diego,San Dieguito Union High,Diegueno Middle,TA,962.0
456,37683466117352,San Dieguito Union High,Carmel Valley Middle,92130-3572,http://sduhsd.net/cv,Intermediate/Middle/Junior High,32.946669,-117.22895,2020-08-13,"3800 Mykonos Lane,San Diego,CA,92130",92130,"Carmel Valley Middle, San Dieguito Union High",S,San Diego,San Dieguito Union High,Carmel Valley Middle,TA,1169.0
457,37683536040331,San Pasqual Union Elementary,San Pasqual Union Elementary,92027-6700,http://www.sanpasqualunion.net,Elementary,33.111418,-117.01127,2020-08-13,"15305 Rockwood Road,Escondido,CA,92027",92027,"San Pasqual Union Elementary, San Pasqual Union Elementary",S,San Diego,San Pasqual Union Elementary,San Pasqual Union Elementary,TA,603.0
458,37683616040349,Santee,Cajon Park Elementary,92071-1704,http://www.santeesd.net,Elementary,32.865962,-116.97111,2020-08-13,"10300 Magnolia Avenue,Santee,CA,92071",92071,"Cajon Park Elementary, Santee",S,San Diego,Santee,Cajon Park Elementary,TA,1048.0
459,37683616040356,Santee,Carlton Hills Elementary,92071-2515,http://www.santeesd.net,Elementary,32.848026,-116.99684,2020-08-13,"9353 Pike Road,Santee,CA,92071",92071,"Carlton Hills Elementary, Santee",S,San Diego,Santee,Carlton Hills Elementary,TA,704.0
460,37683616040364,Santee,Chet F. Harritt Elementary,92071-3513,http://www.santeesd.net,Elementary,32.831437,-117.01939,2020-08-13,"8120 Arlette Street,Santee,CA,92071",92071,"Chet F. Harritt Elementary, Santee",S,San Diego,Santee,Chet F. Harritt Elementary,TA,679.0
461,37683616040372,Santee,Pepper Drive Elementary,92020-1155,http://www.santeesd.net,Elementary,32.826876,-116.95401,2020-08-13,"1935 Marlinda Way,El Cajon,CA,92020",92020,"Pepper Drive Elementary, Santee",S,San Diego,Santee,Pepper Drive Elementary,TA,1022.0
462,37683616040380,Santee,PRIDE Academy at Prospect Avenue,92071-3798,http://www.santeesd.net,Elementary,32.833793,-116.996,2020-08-13,"9303 Prospect Avenue,Santee,CA,92071",92071,"PRIDE Academy at Prospect Avenue, Santee",S,San Diego,Santee,PRIDE Academy at Prospect Avenue,TA,632.0
463,37683616040406,Santee,Sycamore Canyon Elementary,92071-1099,http://www.santeesd.net,Elementary,32.862781,-117.00388,2020-08-13,"10201 Settle Road,Santee,CA,92071",92071,"Sycamore Canyon Elementary, Santee",S,San Diego,Santee,Sycamore Canyon Elementary,TA,396.0
464,37683616068159,Santee,Carlton Oaks Elementary,92071-2354,http://www.santeesd.net,Elementary,32.844606,-117.01489,2020-08-13,"9353 Wethersfield Road,Santee,CA,92071",92071,"Carlton Oaks Elementary, Santee",S,San Diego,Santee,Carlton Oaks Elementary,TA,903.0
465,37683616085153,Santee,Rio Seco Elementary,92071-2674,http://www.santeesd.net,Elementary,32.851376,-116.98324,2020-08-13,"9545 Cuyamaca Street,Santee,CA,92071",92071,"Rio Seco Elementary, Santee",S,San Diego,Santee,Rio Seco Elementary,TA,1062.0
466,37683616085161,Santee,Hill Creek Elementary,92071-2836,http://www.santeesd.net,Elementary,32.852951,-116.96326,2020-08-13,"9665 Jeremy Street,Santee,CA,92071",92071,"Hill Creek Elementary, Santee",S,San Diego,Santee,Hill Creek Elementary,TA,818.0
467,37683616111041,Santee,Santee Alternative,92071,http://www.santeesd.net,Elementary,32.862499,-116.97421,2019-02-13,"10250 El Nopal,Santee,CA,92071",92071,"Santee Alternative, Santee",S,San Diego,Santee,Santee Alternative,TA,34.0
468,37683616120190,Santee,Santee Success Program,92071-1998,http://www.santeesd.net,Intermediate/Middle/Junior High,32.865952,-116.97111,2019-02-13,"10280 North Magnolia Avenue,Santee,CA,92071",92071,"Santee Success Program, Santee",S,San Diego,Santee,Santee Success Program,TA,18.0
469,37683790123000,San Ysidro Elementary,Willow Elementary,92173-3096,http://www.sysdschools.org,Elementary,32.547737,-117.04235,2019-02-13,"226 Willow Road,San Ysidro,CA,92173",92173,"Willow Elementary, San Ysidro Elementary",S,San Diego,San Ysidro Elementary,Willow Elementary,TA,890.0
470,37683790137737,San Ysidro Elementary,Vista Del Mar,92154-8401,http://www.sysdschools.org,Intermediate/Middle/Junior High,32.570714,-117.02802,2020-08-13,"4885 Del Sol Boulevard,San Diego,CA,92154",92154,"Vista Del Mar, San Ysidro Elementary",S,San Diego,San Ysidro Elementary,Vista Del Mar,TA,444.0
471,37683796085146,San Ysidro Elementary,Smythe Elementary,92173-1599,http://www.sysdschools.org,Elementary,32.562092,-117.04941,2019-02-13,"1880 Smythe Avenue,San Ysidro,CA,92173",92173,"Smythe Elementary, San Ysidro Elementary",S,San Diego,San Ysidro Elementary,Smythe Elementary,TA,716.0
472,37683796089007,San Ysidro Elementary,La Mirada Elementary,92173-1508,http://www.sysdschools.org,Elementary,32.564207,-117.04606,2020-08-13,"222 Avenida de la Madrid,San Ysidro,CA,92173",92173,"La Mirada Elementary, San Ysidro Elementary",S,San Diego,San Ysidro Elementary,La Mirada Elementary,TA,471.0
473,37683796093264,San Ysidro Elementary,Sunset Elementary,92173-3334,http://www.sysdschools.org,Elementary,32.5582,-117.04998,2019-02-13,"3825 Sunset Lane,San Ysidro,CA,92173",92173,"Sunset Elementary, San Ysidro Elementary",S,San Diego,San Ysidro Elementary,Sunset Elementary,TA,742.0
474,37683796098453,San Ysidro Elementary,San Ysidro Middle,92173-1623,http://www.sysdschools.org,Intermediate/Middle/Junior High,32.562958,-117.03832,2020-08-13,"4345 Otay Mesa Road,San Ysidro,CA,92173",92173,"San Ysidro Middle, San Ysidro Elementary",S,San Diego,San Ysidro Elementary,San Ysidro Middle,TA,722.0
475,37683796119341,San Ysidro Elementary,Ocean View Hills,92154-8488,http://www.sysdschools.org,Elementary,32.572128,-117.02577,2019-10-24,"4919 Del Sol Boulevard,San Diego,CA,92154",92154,"Ocean View Hills, San Ysidro Elementary",S,San Diego,San Ysidro Elementary,Ocean View Hills,TA,1077.0
476,37683870105825,Solana Beach Elementary,Solana Pacific Elementary,92130-2584,,Elementary,32.952072,-117.23132,2020-08-13,"3901 Townsgate Drive,San Diego,CA,92130",92130,"Solana Pacific Elementary, Solana Beach Elementary",S,San Diego,Solana Beach Elementary,Solana Pacific Elementary,TA,573.0
477,37683870129049,Solana Beach Elementary,Solana Ranch Elementary,92130-5791,http://www.sbsd.k12.ca.us,Elementary,32.964436,-117.19227,2020-08-13,"13605 Pacific Highlands Ranch Parkway,San Diego,CA,92130",92130,"Solana Ranch Elementary, Solana Beach Elementary",S,San Diego,Solana Beach Elementary,Solana Ranch Elementary,TA,605.0
478,37683876040455,Solana Beach Elementary,Skyline Elementary,92075-1400,,Elementary,32.996163,-117.26298,2020-08-13,"606 Lomas Santa Fe Drive,Solana Beach,CA,92075",92075,"Skyline Elementary, Solana Beach Elementary",S,San Diego,Solana Beach Elementary,Skyline Elementary,TA,528.0
479,37683876070882,Solana Beach Elementary,Solana Vista Elementary,92075-1535,,Elementary,33.00415,-117.25085,2020-08-13,"780 Santa Victoria Avenue,Solana Beach,CA,92075",92075,"Solana Vista Elementary, Solana Beach Elementary",S,San Diego,Solana Beach Elementary,Solana Vista Elementary,TA,359.0
480,37683876106140,Solana Beach Elementary,Solana Highlands Elementary,92130-1808,,Elementary,32.954318,-117.24018,2020-08-13,"3520 Long Run Drive,San Diego,CA,92130",92130,"Solana Highlands Elementary, Solana Beach Elementary",S,San Diego,Solana Beach Elementary,Solana Highlands Elementary,TA,323.0
481,37683876111181,Solana Beach Elementary,Solana Santa Fe Elementary,92067-8940,,Elementary,32.997084,-117.19246,2020-08-13,"6570 El Apajo,Rancho Santa Fe,CA,92067",92067,"Solana Santa Fe Elementary, Solana Beach Elementary",S,San Diego,Solana Beach Elementary,Solana Santa Fe Elementary,TA,337.0
482,37683876112353,Solana Beach Elementary,Carmel Creek Elementary,92130-2480,http://sbsd.k12.ca.us/cc,Elementary,32.950872,-117.22565,2020-08-13,"4210 Carmel Center Road,San Diego,CA,92130",92130,"Carmel Creek Elementary, Solana Beach Elementary",S,San Diego,Solana Beach Elementary,Carmel Creek Elementary,TA,392.0
483,37683956040463,South Bay Union,Bayside STEAM Academy,91932-1524,,Elementary,32.587565,-117.11311,2020-08-13,"490 Emory Street,Imperial Beach,CA,91932",91932,"Bayside STEAM Academy, South Bay Union",S,San Diego,South Bay Union,Bayside STEAM Academy,TA,590.0
484,37683956040471,South Bay Union,Central Elementary,91932-2920,,Elementary,32.577528,-117.10592,2020-08-13,"1290 Ebony Avenue,Imperial Beach,CA,91932",91932,"Central Elementary, South Bay Union",S,San Diego,South Bay Union,Central Elementary,TA,594.0
485,37683956040489,South Bay Union,Emory Elementary,92154-2021,,Elementary,32.576466,-117.09159,2020-08-13,"1915 Coronado Avenue,San Diego,CA,92154",92154,"Emory Elementary, South Bay Union",S,San Diego,South Bay Union,Emory Elementary,TA,580.0
486,37683956040521,South Bay Union,Oneonta Elementary,91932-3403,,Elementary,32.57272,-117.11215,2019-02-13,"1311 Tenth Street,Imperial Beach,CA,91932",91932,"Oneonta Elementary, South Bay Union",S,San Diego,South Bay Union,Oneonta Elementary,TA,572.0
487,37683956040539,South Bay Union,Sunnyslope Elementary,92154-1498,,Elementary,32.58014,-117.07974,2019-07-15,"2500 Elm Avenue,San Diego,CA,92154",92154,"Sunnyslope Elementary, South Bay Union",S,San Diego,South Bay Union,Sunnyslope Elementary,TA,560.0
488,37683956067029,South Bay Union,Godfrey G. Berry Elementary,92154-3032,,Elementary,32.568151,-117.08999,2020-08-13,"2001 Rimbey Street,San Diego,CA,92154",92154,"Godfrey G. Berry Elementary, South Bay Union",S,San Diego,South Bay Union,Godfrey G. Berry Elementary,TA,545.0
489,37683956094973,South Bay Union,Howard Pence Elementary,92154-2256,,Elementary,32.579102,-117.06191,2019-07-15,"877 Via Tonga Court,San Diego,CA,92154",92154,"Howard Pence Elementary, South Bay Union",S,San Diego,South Bay Union,Howard Pence Elementary,TA,723.0
490,37683956098487,South Bay Union,George Nicoloff Elementary,92173-1235,,Elementary,32.564248,-117.06662,2020-07-09,"1777 Howard Avenue,San Ysidro,CA,92173",92173,"George Nicoloff Elementary, South Bay Union",S,San Diego,South Bay Union,George Nicoloff Elementary,TA,818.0
491,37683956116008,South Bay Union,Teofilo Mendoza,92154-2034,,Elementary,32.576464,-117.08954,2020-08-13,"2050 Coronado Avenue,San Diego,CA,92154",92154,"Teofilo Mendoza, South Bay Union",S,San Diego,South Bay Union,Teofilo Mendoza,TA,871.0
492,37684036040554,Spencer Valley Elementary,Spencer Valley Elementary,92070-0159,http://svesd.net,Elementary,33.09656,-116.64555,2019-02-13,"4414 Highway 78 and 79,Santa Ysabel,CA,92070",92070,"Spencer Valley Elementary, Spencer Valley Elementary",S,San Diego,Spencer Valley Elementary,Spencer Valley Elementary,TA,47.0
493,37684110111831,Sweetwater Union High,Olympian High,91913-3973,http://www.sweetwaterschools.org,High School,32.607105,-116.97209,2019-02-13,"1925 Magdalena Avenue,Chula Vista,CA,91913",91913,"Olympian High, Sweetwater Union High",S,San Diego,Sweetwater Union High,Olympian High,TA,2604.0
494,37684110115873,Sweetwater Union High,East Hills Academy,91913,http://www.sweetwaterschools.org/,High School,32.6101,-117.0768,2020-08-13,"1791 Rock Mountain Road,Chula Vista,CA,91913",91913,"East Hills Academy, Sweetwater Union High",S,San Diego,Sweetwater Union High,East Hills Academy,TA,82.0
495,37684113730124,Sweetwater Union High,Southwest Senior High,92154-4548,http://www.sweetwaterschools.org,High School,32.568057,-117.08409,2019-08-26,"1685 Hollister Street,San Diego,CA,92154",92154,"Southwest Senior High, Sweetwater Union High",S,San Diego,Sweetwater Union High,Southwest Senior High,TA,1933.0
496,37684113730405,Sweetwater Union High,Bonita Vista Senior High,91913-2004,http://www.sweetwaterschools.org/,High School,32.64603,-117.00114,2019-02-13,"751 Otay Lakes Road,Chula Vista,CA,91913",91913,"Bonita Vista Senior High, Sweetwater Union High",S,San Diego,Sweetwater Union High,Bonita Vista Senior High,TA,2479.0
497,37684113730801,Sweetwater Union High,Castle Park Senior High,91911-4529,,High School,32.606982,-117.05284,2019-02-13,"1395 Hilltop Drive,Chula Vista,CA,91911",91911,"Castle Park Senior High, Sweetwater Union High",S,San Diego,Sweetwater Union High,Castle Park Senior High,TA,1926.0
498,37684113730843,Sweetwater Union High,Eastlake High,91915-2102,http://www.sweetwaterschools.org,High School,32.646442,-116.96522,2019-08-26,"1120 Eastlake Parkway,Chula Vista,CA,91915",91915,"Eastlake High, Sweetwater Union High",S,San Diego,Sweetwater Union High,Eastlake High,TA,3046.0
499,37684113731064,Sweetwater Union High,Chula Vista Senior High,91911-1102,,High School,32.622027,-117.07697,2020-08-12,"820 Fourth Avenue,Chula Vista,CA,91911",91911,"Chula Vista Senior High, Sweetwater Union High",S,San Diego,Sweetwater Union High,Chula Vista Senior High,TA,2701.0
500,37684113731155,Sweetwater Union High,Options Secondary,91911-1705,,High School,32.61526,-117.07696,2020-08-13,"467 Moss Street,Chula Vista,CA,91911",91911,"Options Secondary, Sweetwater Union High",S,San Diego,Sweetwater Union High,Options Secondary,TA,135.0
501,37684113731460,Sweetwater Union High,Alta Vista Academy,91911-6618,http://www.sweetwaterschools.org,High School,32.61872,-117.02445,2020-08-13,"730 Medical Center Court,Chula Vista,CA,91911",91911,"Alta Vista Academy, Sweetwater Union High",S,San Diego,Sweetwater Union High,Alta Vista Academy,TA,77.0
502,37684113731502,Sweetwater Union High,San Ysidro High,92154-4806,http://www.sweetwaterschools.org,High School,32.566438,-117.01748,2019-02-13,"5353 Airway Road,San Diego,CA,92154",92154,"San Ysidro High, Sweetwater Union High",S,San Diego,Sweetwater Union High,San Ysidro High,TA,2632.0
503,37684113731627,Sweetwater Union High,Otay Ranch Senior High,91913-1900,http://www.sweetwaterschools.org,High School,32.619073,-116.99635,2019-02-13,"1250 Olympic Parkway,Chula Vista,CA,91913",91913,"Otay Ranch Senior High, Sweetwater Union High",S,San Diego,Sweetwater Union High,Otay Ranch Senior High,TA,2510.0
504,37684113732047,Sweetwater Union High,Palomar High,91911-3098,http://www.sweetwaterschools.org,High School,32.604757,-117.07385,2019-08-27,"480 Palomar Street,Chula Vista,CA,91911",91911,"Palomar High, Sweetwater Union High",S,San Diego,Sweetwater Union High,Palomar High,TA,440.0
505,37684113732849,Sweetwater Union High,Hilltop Senior High,91910-6105,http://www.sweetwaterschools.org,High School,32.636851,-117.0599,2019-10-31,"555 Claire Avenue,Chula Vista,CA,91910",91910,"Hilltop Senior High, Sweetwater Union High",S,San Diego,Sweetwater Union High,Hilltop Senior High,TA,2224.0
506,37684113733953,Sweetwater Union High,Mar Vista Senior High,91932-2027,,High School,32.580208,-117.12224,2019-08-26,"505 Elm Avenue,Imperial Beach,CA,91932",91932,"Mar Vista Senior High, Sweetwater Union High",S,San Diego,Sweetwater Union High,Mar Vista Senior High,TA,1759.0
507,37684113738226,Sweetwater Union High,Sweetwater High,91950-7415,http://www.sweetwaterschools.org,High School,32.659933,-117.0917,2019-02-13,"2900 Highland Avenue,National City,CA,91950",91950,"Sweetwater High, Sweetwater Union High",S,San Diego,Sweetwater Union High,Sweetwater High,TA,2865.0
508,37684113738234,Sweetwater Union High,Montgomery Senior High,92154-1507,,High School,32.583873,-117.06422,2019-08-26,"3250 Palm Avenue,San Diego,CA,92154",92154,"Montgomery Senior High, Sweetwater Union High",S,San Diego,Sweetwater Union High,Montgomery Senior High,TA,2054.0
509,37684116059745,Sweetwater Union High,Bonita Vista Middle,91910-6910,http://www.sweetwaterschools.org/,Intermediate/Middle/Junior High,32.648596,-117.00527,2019-02-13,"650 Otay Lakes Road,Chula Vista,CA,91910",91910,"Bonita Vista Middle, Sweetwater Union High",S,San Diego,Sweetwater Union High,Bonita Vista Middle,TA,1249.0
510,37684116059752,Sweetwater Union High,Castle Park Middle,91911-4414,,Intermediate/Middle/Junior High,32.604981,-117.05939,2019-02-13,"160 Quintard Street,Chula Vista,CA,91911",91911,"Castle Park Middle, Sweetwater Union High",S,San Diego,Sweetwater Union High,Castle Park Middle,TA,905.0
511,37684116059760,Sweetwater Union High,Chula Vista Middle,91910-4305,,Intermediate/Middle/Junior High,32.635067,-117.08645,2020-08-10,"415 Fifth Avenue,Chula Vista,CA,91910",91910,"Chula Vista Middle, Sweetwater Union High",S,San Diego,Sweetwater Union High,Chula Vista Middle,TA,963.0
512,37684116059778,Sweetwater Union High,Granger Junior High,91950-6299,http://www.sweetwaterschools.org,Intermediate/Middle/Junior High,32.672621,-117.07383,2019-08-26,"2101 Granger Avenue,National City,CA,91950",91950,"Granger Junior High, Sweetwater Union High",S,San Diego,Sweetwater Union High,Granger Junior High,TA,1032.0
513,37684116059786,Sweetwater Union High,Mar Vista Academy,92154-2802,http://www.sweetwaterschools.org,Intermediate/Middle/Junior High,32.57488,-117.09709,2019-02-13,"1267 Thermal Avenue,San Diego,CA,92154",92154,"Mar Vista Academy, Sweetwater Union High",S,San Diego,Sweetwater Union High,Mar Vista Academy,TA,827.0
514,37684116059794,Sweetwater Union High,National City Middle,91950-4535,http://www.sweetwaterschools.org,Intermediate/Middle/Junior High,32.669245,-117.09973,2019-08-26,"1701 D Avenue,National City,CA,91950",91950,"National City Middle, Sweetwater Union High",S,San Diego,Sweetwater Union High,National City Middle,TA,885.0
515,37684116062004,Sweetwater Union High,Hilltop Middle,91910-6115,http://www.sweetwaterschools.org/,Intermediate/Middle/Junior High,32.630395,-117.06408,2019-08-26,"44 East J Street,Chula Vista,CA,91910",91910,"Hilltop Middle, Sweetwater Union High",S,San Diego,Sweetwater Union High,Hilltop Middle,TA,1071.0
516,37684116062012,Sweetwater Union High,Southwest Middle,92154-3338,http://www.sweetwaterschools.org,Intermediate/Middle/Junior High,32.569138,-117.07381,2019-02-13,"2710 Iris Street,San Diego,CA,92154",92154,"Southwest Middle, Sweetwater Union High",S,San Diego,Sweetwater Union High,Southwest Middle,TA,754.0
517,37684116070890,Sweetwater Union High,Montgomery Middle,92154-3548,,Intermediate/Middle/Junior High,32.576045,-117.05612,2019-02-13,"1051 Picador Boulevard,San Diego,CA,92154",92154,"Montgomery Middle, Sweetwater Union High",S,San Diego,Sweetwater Union High,Montgomery Middle,TA,969.0
518,37684116114276,Sweetwater Union High,Rancho del Rey Middle,91910-7040,http://www.sweetwaterschools.org,Intermediate/Middle/Junior High,32.630868,-117.00764,2019-02-13,"1174 East J Street,Chula Vista,CA,91910",91910,"Rancho del Rey Middle, Sweetwater Union High",S,San Diego,Sweetwater Union High,Rancho del Rey Middle,TA,1841.0
519,37684116117154,Sweetwater Union High,Sweetwater Community Day,91911-4404,,High School,32.605905,-117.06115,2020-08-13,"1355 Second Avenue,Chula Vista,CA,91911",91911,"Sweetwater Community Day, Sweetwater Union High",S,San Diego,Sweetwater Union High,Sweetwater Community Day,TA,45.0
520,37684116120968,Sweetwater Union High,Eastlake Middle,91914-2626,http://www.sweetwaterschools.org,Intermediate/Middle/Junior High,32.655591,-116.94818,2019-08-26,"900 Duncan Ranch Road,Chula Vista,CA,91914",91914,"Eastlake Middle, Sweetwater Union High",S,San Diego,Sweetwater Union High,Eastlake Middle,TA,1896.0
521,37684376040562,Vallecitos Elementary,Vallecitos Elementary,92028-9795,,Elementary,33.413921,-117.14871,2020-08-13,"5211 Fifth Street,Rainbow,CA,92028",92028,"Vallecitos Elementary, Vallecitos Elementary",S,San Diego,Vallecitos Elementary,Vallecitos Elementary,TA,224.0
522,37684520100925,Vista Unified,T.H.E Leadership Academy,92056-3066,http://www.th.vistausd.org,Elementary,33.218505,-117.27087,2020-08-13,"1550 Temple Heights Drive,Oceanside,CA,92056",92056,"T.H.E Leadership Academy, Vista Unified",S,San Diego,Vista Unified,T.H.E Leadership Academy,TA,728.0
523,37684520100933,Vista Unified,Hannalei Elementary,92083-7625,http://www.han.vistausd.org,Elementary,33.178337,-117.21575,2020-08-13,"120 Hannalei Drive,Vista,CA,92083",92083,"Hannalei Elementary, Vista Unified",S,San Diego,Vista Unified,Hannalei Elementary,TA,614.0
524,37684520105882,Vista Unified,Foothill Oak Elementary,92084-4001,http://www.fho.vistausd.org,Elementary,33.218194,-117.22187,2020-08-13,"1370 Oak Drive,Vista,CA,92084",92084,"Foothill Oak Elementary, Vista Unified",S,San Diego,Vista Unified,Foothill Oak Elementary,TA,628.0
525,37684520111237,Vista Unified,Maryland Elementary,92084-2906,http://www.me.vistausd.org,Elementary,33.215538,-117.25793,2020-08-13,"700 North Avenue,Vista,CA,92084",92084,"Maryland Elementary, Vista Unified",S,San Diego,Vista Unified,Maryland Elementary,TA,720.0
526,37684520114637,Vista Unified,"Vista Magnet Middle School of Technology, Science, and Math",92084-6035,http://www.vmms.vistausd.org,Intermediate/Middle/Junior High,33.20314,-117.23667,2020-08-13,"151 Civic Center Drive,Vista,CA,92084",92084,"Vista Magnet Middle School of Technology, Science, and Math, Vista Unified",S,San Diego,Vista Unified,"Vista Magnet Middle School of Technology, Science, and Math",TA,850.0
