,CDSCode,District,School_x,Zip,WebSite,EILName,Latitude,Longitude,LastUpDate,Address,Zipcode,"School, District",AggregateLevel,CountyName,DistrictName,School_y,ReportingCategory,CumulativeEnrollment
0,37103710115998,San Diego County Office of Education,San Pasqual Academy,92025-5301,http://www.sanpasqualacademy.org,High School,33.09058,-116.95009,2019-02-13,"17701 San Pasqual Valley Road,Escondido,CA,92025",92025,"San Pasqual Academy, San Diego County Office of Education",S,San Diego,San Diego County Office of Education,San Pasqual Academy,TA,94.0
1,37103710120485,San Diego County Office of Education,Davila Day,91910-3604,,Elementary,32.635041,-117.08832,2019-02-13,"540 G Street,Chula Vista,CA,91910",91910,"Davila Day, San Diego County Office of Education",S,San Diego,San Diego County Office of Education,Davila Day,TA,34.0
2,37103710120493,San Diego County Office of Education,Monarch,92113-1012,http://www.monarchschools.org,Elementary-High Combination,32.702375,-117.15045,2020-08-24,"1625 Newton Avenue,San Diego,CA,92113",92113,"Monarch, San Diego County Office of Education",S,San Diego,San Diego County Office of Education,Monarch,TA,333.0
3,37103710128520,San Diego County Office of Education,San Diego County Community,92111-7399,http://www.sdcoe.net,Elementary-High Combination,32.769578,-117.17984,2020-08-21,"6401 Linda Vista Road, Room 216,San Diego,CA,92111",92111,"San Diego County Community, San Diego County Office of Education",S,San Diego,San Diego County Office of Education,San Diego County Community,TA,1366.0
4,37103710128538,San Diego County Office of Education,San Diego County Court,92123,http://www.sdcoe.net/jccs,High School,32.794147,-117.15396,2019-02-13,"2801 Meadow Lark Drive,San Diego,CA,92123",92123,"San Diego County Court, San Diego County Office of Education",S,San Diego,San Diego County Office of Education,San Diego County Court,TA,1433.0
5,37103711996545,San Diego County Office of Education,North Coastal Consortium Schools,92069-3709,http://nccse.org,Elementary-High Combination,33.142539,-117.16504,2019-02-13,"255 Pico Avenue, Room 220,San Marcos,CA,92069",92069,"North Coastal Consortium Schools, San Diego County Office of Education",S,San Diego,San Diego County Office of Education,North Coastal Consortium Schools,TA,115.0
6,37103716069355,San Diego County Office of Education,San Diego County Special Education,92111-7319,http://www.sdcoe.net,Elementary-High Combination,32.769409,-117.1796,2019-11-20,"6401 Linda Vista Road, Room 409,San Diego,CA,92111",92111,"San Diego County Special Education, San Diego County Office of Education",S,San Diego,San Diego County Office of Education,San Diego County Special Education,TA,41.0
7,37679676037535,Alpine Union Elementary,Joan MacQueen Middle,91901-3129,http://www.alpineschools.net/joanmac,Intermediate/Middle/Junior High,32.825432,-116.77538,2019-02-13,"2001 Tavern Road,Alpine,CA,91901",91901,"Joan MacQueen Middle, Alpine Union Elementary",S,San Diego,Alpine Union Elementary,Joan MacQueen Middle,TA,467.0
8,37679676106256,Alpine Union Elementary,Shadow Hills Elementary,91901-2615,http://www.alpineschools.net/shadowhills,Elementary,32.8319,-116.81522,2019-02-26,"8770 Harbison Canyon Road,Alpine,CA,91901",91901,"Shadow Hills Elementary, Alpine Union Elementary",S,San Diego,Alpine Union Elementary,Shadow Hills Elementary,TA,410.0
9,37679676109086,Alpine Union Elementary,Boulder Oaks Elementary,91901-3134,http://www.alpineschools.net/boulderoaks,Elementary,32.819163,-116.77617,2020-08-13,"2320 Tavern Road,Alpine,CA,91901",91901,"Boulder Oaks Elementary, Alpine Union Elementary",S,San Diego,Alpine Union Elementary,Boulder Oaks Elementary,TA,360.0
10,37679676109953,Alpine Union Elementary,Mountain View Learning Academy,91901-2615,http://www.alpineschools.net/mountainview,Elementary,32.832208,-116.81507,2020-08-13,"8770 Harbison Canyon Road,Alpine,CA,91901",91901,"Mountain View Learning Academy, Alpine Union Elementary",S,San Diego,Alpine Union Elementary,Mountain View Learning Academy,TA,82.0
11,37679676118723,Alpine Union Elementary,Creekside Early Learning Center,91901-2616,http://www.alpineschools.net/creekside,Elementary,32.832208,-116.81507,2019-02-13,"8818 Harbison Canyon Road,Alpine,CA,91901",91901,"Creekside Early Learning Center, Alpine Union Elementary",S,San Diego,Alpine Union Elementary,Creekside Early Learning Center,TA,293.0
12,37679833730447,Borrego Springs Unified,Borrego Springs High,92004-0235,http://www.bsusd.net,High School,33.265514,-116.38373,2019-11-06,"2281 Diegueno Road,Borrego Springs,CA,92004",92004,"Borrego Springs High, Borrego Springs Unified",S,San Diego,Borrego Springs Unified,Borrego Springs High,TA,132.0
13,37679836037550,Borrego Springs Unified,Borrego Springs Elementary,92004-0235,,Elementary,33.256865,-116.34685,2019-02-13,"1315 Palm Canyon Drive,Borrego Springs,CA,92004",92004,"Borrego Springs Elementary, Borrego Springs Unified",S,San Diego,Borrego Springs Unified,Borrego Springs Elementary,TA,194.0
14,37679836115315,Borrego Springs Unified,Borrego Springs Middle,92004,,Intermediate/Middle/Junior High,33.264682,-116.38367,2019-11-06,"2255 Diegueno Road,Borrego Springs,CA,92004",92004,"Borrego Springs Middle, Borrego Springs Unified",S,San Diego,Borrego Springs Unified,Borrego Springs Middle,TA,94.0
15,37679910111005,Cajon Valley Union,Los Coches Creek Middle,92021-2619,,Intermediate/Middle/Junior High,32.858622,-116.81938,2020-08-13,"9669 Dunbar Lane,El Cajon,CA,92021",92021,"Los Coches Creek Middle, Cajon Valley Union",S,San Diego,Cajon Valley Union,Los Coches Creek Middle,TA,836.0
16,37679910136176,Cajon Valley Union,Empower,92020-4015,http://www.cajonvalley.net,Intermediate/Middle/Junior High,32.795836,-116.95489,2020-08-13,"165 Roanoke Road,El Cajon,CA,92020",92020,"Empower, Cajon Valley Union",S,San Diego,Cajon Valley Union,Empower,TA,26.0
17,37679916037568,Cajon Valley Union,Anza Elementary,92020-8602,,Elementary,32.786,-116.9478,2020-08-13,"1005 South Anza Street,El Cajon,CA,92020",92020,"Anza Elementary, Cajon Valley Union",S,San Diego,Cajon Valley Union,Anza Elementary,TA,628.0
18,37679916037576,Cajon Valley Union,Bostonia Language Academy,92021-5812,,Elementary,32.807818,-116.93171,2019-08-22,"1390 East Broadway,El Cajon,CA,92021",92021,"Bostonia Language Academy, Cajon Valley Union",S,San Diego,Cajon Valley Union,Bostonia Language Academy,TA,625.0
19,37679916037584,Cajon Valley Union,Cajon Valley Middle,92020-3922,,Intermediate/Middle/Junior High,32.798383,-116.95555,2020-08-13,"550 Park Avenue,El Cajon,CA,92020",92020,"Cajon Valley Middle, Cajon Valley Union",S,San Diego,Cajon Valley Union,Cajon Valley Middle,TA,1070.0
20,37679916037592,Cajon Valley Union,Chase Avenue Elementary,92020-6201,,Elementary,32.780336,-116.96003,2020-08-13,"195 East Chase Avenue,El Cajon,CA,92020",92020,"Chase Avenue Elementary, Cajon Valley Union",S,San Diego,Cajon Valley Union,Chase Avenue Elementary,TA,832.0
21,37679916037600,Cajon Valley Union,Crest Elementary,92021-4249,,Elementary,32.805538,-116.86647,2020-08-14,"2000 Suncrest Boulevard,El Cajon,CA,92021",92021,"Crest Elementary, Cajon Valley Union",S,San Diego,Cajon Valley Union,Crest Elementary,TA,119.0
22,37679916037626,Cajon Valley Union,Emerald Middle,92020-7315,,Intermediate/Middle/Junior High,32.778996,-116.96869,2020-08-14,"1221 South Emerald Avenue,El Cajon,CA,92020",92020,"Emerald Middle, Cajon Valley Union",S,San Diego,Cajon Valley Union,Emerald Middle,TA,679.0
23,37679916037634,Cajon Valley Union,Flying Hills School of Arts,92020-1433,,Elementary,32.811827,-116.9824,2020-08-13,"1251 Finch Street,El Cajon,CA,92020",92020,"Flying Hills School of Arts, Cajon Valley Union",S,San Diego,Cajon Valley Union,Flying Hills School of Arts,TA,586.0
24,37679916037642,Cajon Valley Union,Fuerte Elementary,92020-8309,,Elementary,32.762217,-116.94678,2020-08-13,"11625 Fuerte Drive,El Cajon,CA,92020",92020,"Fuerte Elementary, Cajon Valley Union",S,San Diego,Cajon Valley Union,Fuerte Elementary,TA,696.0
25,37679916037659,Cajon Valley Union,Greenfield Middle,92021-3414,,Intermediate/Middle/Junior High,32.811048,-116.92834,2020-08-14,"1495 Greenfield Drive,El Cajon,CA,92021",92021,"Greenfield Middle, Cajon Valley Union",S,San Diego,Cajon Valley Union,Greenfield Middle,TA,860.0
26,37679916037675,Cajon Valley Union,Johnson Elementary,92020-3211,,Elementary,32.8008,-116.9562,2019-02-13,"500 West Madison,El Cajon,CA,92020",92020,"Johnson Elementary, Cajon Valley Union",S,San Diego,Cajon Valley Union,Johnson Elementary,TA,795.0
27,37679916037683,Cajon Valley Union,Lexington Elementary,92019-4739,,Elementary,32.791145,-116.94234,2020-08-14,"1145 Redwood Avenue,El Cajon,CA,92019",92019,"Lexington Elementary, Cajon Valley Union",S,San Diego,Cajon Valley Union,Lexington Elementary,TA,936.0
28,37679916037691,Cajon Valley Union,Madison Avenue Elementary,92019-1046,,Elementary,32.800143,-116.922,2020-08-13,"1615 East Madison Avenue,El Cajon,CA,92019",92019,"Madison Avenue Elementary, Cajon Valley Union",S,San Diego,Cajon Valley Union,Madison Avenue Elementary,TA,707.0
29,37679916037709,Cajon Valley Union,Magnolia Elementary,92021-2957,,Elementary,32.813388,-116.95404,2020-08-13,"650 Greenfield Drive,El Cajon,CA,92021",92021,"Magnolia Elementary, Cajon Valley Union",S,San Diego,Cajon Valley Union,Magnolia Elementary,TA,655.0
30,37679916037717,Cajon Valley Union,Meridian Elementary,92019-2517,,Elementary,32.788386,-116.92685,2020-08-13,"651 South Third Street,El Cajon,CA,92019",92019,"Meridian Elementary, Cajon Valley Union",S,San Diego,Cajon Valley Union,Meridian Elementary,TA,648.0
31,37679916037725,Cajon Valley Union,Naranca Elementary,92021-5615,,Elementary,32.803995,-116.94638,2020-08-13,"1030 Naranca Avenue,El Cajon,CA,92021",92021,"Naranca Elementary, Cajon Valley Union",S,San Diego,Cajon Valley Union,Naranca Elementary,TA,930.0
32,37679916037733,Cajon Valley Union,Rios Elementary,92021-2725,,Elementary,32.840076,-116.87577,2020-08-13,"14314 Rios Canyon Road,El Cajon,CA,92021",92021,"Rios Elementary, Cajon Valley Union",S,San Diego,Cajon Valley Union,Rios Elementary,TA,401.0
33,37679916037741,Cajon Valley Union,W. D. Hall Elementary,92021-1460,,Elementary,32.820878,-116.93116,2020-08-14,"1376 Pepper Drive,El Cajon,CA,92021",92021,"W. D. Hall Elementary, Cajon Valley Union",S,San Diego,Cajon Valley Union,W. D. Hall Elementary,TA,642.0
34,37679916069082,Cajon Valley Union,Avocado Elementary,91941-7319,,Elementary,32.750432,-116.96075,2020-08-13,"3845 Avocado School Road,La Mesa,CA,91941",91941,"Avocado Elementary, Cajon Valley Union",S,San Diego,Cajon Valley Union,Avocado Elementary,TA,628.0
35,37679916093207,Cajon Valley Union,Montgomery Middle,92019-2015,,Intermediate/Middle/Junior High,32.79653,-116.92542,2020-08-13,"1570 Melody Lane,El Cajon,CA,92019",92019,"Montgomery Middle, Cajon Valley Union",S,San Diego,Cajon Valley Union,Montgomery Middle,TA,985.0
36,37679916101794,Cajon Valley Union,Vista Grande Elementary,92019-3823,,Elementary,32.76508,-116.91501,2020-08-13,"1908 Vista Grande Road,El Cajon,CA,92019",92019,"Vista Grande Elementary, Cajon Valley Union",S,San Diego,Cajon Valley Union,Vista Grande Elementary,TA,635.0
37,37679916106025,Cajon Valley Union,Rancho San Diego Elementary,92019-4825,,Elementary,32.754628,-116.93287,2020-08-13,"12151 Calle Albara,El Cajon,CA,92019",92019,"Rancho San Diego Elementary, Cajon Valley Union",S,San Diego,Cajon Valley Union,Rancho San Diego Elementary,TA,628.0
38,37679916110787,Cajon Valley Union,Jamacha Elementary,92019-4640,,Elementary,32.740143,-116.91223,2020-08-13,"2962 Jamul Drive,El Cajon,CA,92019",92019,"Jamacha Elementary, Cajon Valley Union",S,San Diego,Cajon Valley Union,Jamacha Elementary,TA,518.0
39,37679916112148,Cajon Valley Union,Blossom Valley Elementary,92021-2300,,Elementary,32.861732,-116.84665,2020-08-13,"9863 Oakmont Terrace,El Cajon,CA,92021",92021,"Blossom Valley Elementary, Cajon Valley Union",S,San Diego,Cajon Valley Union,Blossom Valley Elementary,TA,573.0
40,37679916112890,Cajon Valley Union,Hillsdale Middle,92019-4374,,Intermediate/Middle/Junior High,32.74944,-116.9324,2020-08-14,"1301 Brabham Street,El Cajon,CA,92019",92019,"Hillsdale Middle, Cajon Valley Union",S,San Diego,Cajon Valley Union,Hillsdale Middle,TA,1581.0
41,37679916118319,Cajon Valley Union,Cajon Valley Home,92021-5812,,Elementary,32.807708,-116.93212,2020-08-13,"1384 Broadway,El Cajon,CA,92021",92021,"Cajon Valley Home, Cajon Valley Union",S,San Diego,Cajon Valley Union,Cajon Valley Home,TA,133.0
42,37680076037758,Cardiff Elementary,Ada W. Harris Elementary,92007-1356,,Elementary,33.03128,-117.27349,2020-08-13,"1508 Windsor Road,Cardiff-by-the-Sea,CA,92007",92007,"Ada W. Harris Elementary, Cardiff Elementary",S,San Diego,Cardiff Elementary,Ada W. Harris Elementary,TA,368.0
43,37680076037766,Cardiff Elementary,Cardiff Elementary,92007-2313,,Elementary,33.025044,-117.2822,2020-08-13,"1888 Montgomery Avenue,Cardiff-by-the-Sea,CA,92007",92007,"Cardiff Elementary, Cardiff Elementary",S,San Diego,Cardiff Elementary,Cardiff Elementary,TA,354.0
44,37680230101592,Chula Vista Elementary,Hedenkamp (Anne and William) Elementary,91913-2895,http://schools.cvesd.org/schools/hedenkamp/,Elementary,32.61674,-117.015,2019-02-13,"930 East Palomar,Chula Vista,CA,91913",91913,"Hedenkamp (Anne and William) Elementary, Chula Vista Elementary",S,San Diego,Chula Vista Elementary,Hedenkamp (Anne and William) Elementary,TA,1035.0
45,37680230105957,Chula Vista Elementary,Liberty Elementary,91914-4026,http://schools.cvesd.org/schools/liberty/,Elementary,32.663976,-116.97761,2019-02-13,"2175 Proctor Valley Road,Chula Vista,CA,91914",91914,"Liberty Elementary, Chula Vista Elementary",S,San Diego,Chula Vista Elementary,Liberty Elementary,TA,722.0
46,37680230105965,Chula Vista Elementary,Salt Creek Elementary,91914-3622,http://schools.cvesd.org/schools/saltcreek/,Elementary,32.649018,-116.94925,2019-02-13,"1055 Hunte Parkway,Chula Vista,CA,91914",91914,"Salt Creek Elementary, Chula Vista Elementary",S,San Diego,Chula Vista Elementary,Salt Creek Elementary,TA,946.0
47,37680230108662,Chula Vista Elementary,Veterans Elementary,91913-3948,http://schools.cvesd.org/schools/veterans/,Elementary,32.623835,-116.97634,2019-02-13,"1550 Magdalena Avenue,Chula Vista,CA,91913",91913,"Veterans Elementary, Chula Vista Elementary",S,San Diego,Chula Vista Elementary,Veterans Elementary,TA,925.0
48,37680230114009,Chula Vista Elementary,Wolf Canyon Elementary,91913-3948,http://schools.cvesd.org/schools/wolfcanyon/,Elementary,32.611931,-116.97324,2020-08-13,"1950 Wolf Canyon Loop,Chula Vista,CA,91913",91913,"Wolf Canyon Elementary, Chula Vista Elementary",S,San Diego,Chula Vista Elementary,Wolf Canyon Elementary,TA,822.0
49,37680230127431,Chula Vista Elementary,Camarena (Enrique S.) Elementary,91915-1961,http://schools.cvesd.org/schools/camarena/,Elementary,32.622811,-116.95651,2019-02-13,"1650 Exploration Falls Drive,Chula Vista,CA,91915",91915,"Camarena (Enrique S.) Elementary, Chula Vista Elementary",S,San Diego,Chula Vista Elementary,Camarena (Enrique S.) Elementary,TA,1094.0
50,37680230135277,Chula Vista Elementary,Muraoka (Saburo) Elementary,91915,http://www.cvesd.org,Elementary,32.615167,-116.99163,2020-01-27,"1644 Santa Alexia Avenue,Chula Vista,CA,91915",91915,"Muraoka (Saburo) Elementary, Chula Vista Elementary",S,San Diego,Chula Vista Elementary,Muraoka (Saburo) Elementary,TA,789.0
51,37680236037824,Chula Vista Elementary,Castle Park Elementary,91910-3309,http://schools.cvesd.org/schools/castlepark/,Elementary,32.615057,-117.05726,2020-08-12,"25 Emerson Street,Chula Vista,CA,91910",91910,"Castle Park Elementary, Chula Vista Elementary",S,San Diego,Chula Vista Elementary,Castle Park Elementary,TA,435.0
52,37680236037832,Chula Vista Elementary,Allen (Ella B.) Elementary,91902-2309,http://schools.cvesd.org/schools/allen/,Elementary,32.656765,-117.03358,2020-08-13,"4300 Allen School Road,Bonita,CA,91902",91902,"Allen (Ella B.) Elementary, Chula Vista Elementary",S,San Diego,Chula Vista Elementary,Allen (Ella B.) Elementary,TA,380.0
53,37680236037840,Chula Vista Elementary,Rohr (Fred H.) Elementary,91911-5999,http://schools.cvesd.org/schools/rohr/,Elementary,32.602452,-117.04055,2020-08-13,"1540 Malta Avenue,Chula Vista,CA,91911",91911,"Rohr (Fred H.) Elementary, Chula Vista Elementary",S,San Diego,Chula Vista Elementary,Rohr (Fred H.) Elementary,TA,326.0
54,37680236037857,Chula Vista Elementary,Rogers (Greg) Elementary,91911-2519,http://schools.cvesd.org/schools/rogers/,Elementary,32.611251,-117.07781,2020-08-13,"510 East Naples Street,Chula Vista,CA,91911",91911,"Rogers (Greg) Elementary, Chula Vista Elementary",S,San Diego,Chula Vista Elementary,Rogers (Greg) Elementary,TA,451.0
55,37680236037865,Chula Vista Elementary,Halecrest Elementary,91910-6499,http://schools.cvesd.org/schools/halecrest/,Elementary,32.634394,-117.04331,2020-08-13,"475 East J Street,Chula Vista,CA,91910",91910,"Halecrest Elementary, Chula Vista Elementary",S,San Diego,Chula Vista Elementary,Halecrest Elementary,TA,507.0
56,37680236037873,Chula Vista Elementary,Harborside Elementary,91911-1619,http://schools.cvesd.org/schools/harborside/,Elementary,32.609058,-117.08551,2019-02-13,"681 Naples Street,Chula Vista,CA,91911",91911,"Harborside Elementary, Chula Vista Elementary",S,San Diego,Chula Vista Elementary,Harborside Elementary,TA,725.0
57,37680236037881,Chula Vista Elementary,Cook (Hazel Goes) Elementary,91911-1501,http://schools.cvesd.org/schools/cook/,Elementary,32.625934,-117.0562,2020-08-13,"875 Cuyamaca Avenue,Chula Vista,CA,91911",91911,"Cook (Hazel Goes) Elementary, Chula Vista Elementary",S,San Diego,Chula Vista Elementary,Cook (Hazel Goes) Elementary,TA,381.0
58,37680236037899,Chula Vista Elementary,Hilltop Drive Elementary,91910-6020,http://schools.cvesd.org/schools/hilltop/,Elementary,32.632209,-117.06414,2020-08-13,"30 Murray Street,Chula Vista,CA,91910",91910,"Hilltop Drive Elementary, Chula Vista Elementary",S,San Diego,Chula Vista Elementary,Hilltop Drive Elementary,TA,564.0
59,37680236037907,Chula Vista Elementary,Lauderbach (J. Calvin) Elementary,91911-3182,http://schools.cvesd.org/schools/lauderbach/,Elementary,32.620279,-117.07566,2019-02-13,"390 Palomar Street,Chula Vista,CA,91911",91911,"Lauderbach (J. Calvin) Elementary, Chula Vista Elementary",S,San Diego,Chula Vista Elementary,Lauderbach (J. Calvin) Elementary,TA,876.0
60,37680236037915,Chula Vista Elementary,Montgomery (John J.) Elementary,91911-5799,http://schools.cvesd.org/schools/montgomery/,Elementary,32.597875,-117.069,2020-08-13,"1601 Fourth Avenue,Chula Vista,CA,91911",91911,"Montgomery (John J.) Elementary, Chula Vista Elementary",S,San Diego,Chula Vista Elementary,Montgomery (John J.) Elementary,TA,363.0
61,37680236037923,Chula Vista Elementary,Kellogg (Karl H.) Elementary,91911-2399,http://schools.cvesd.org/schools/kellogg/,Elementary,32.619721,-117.04805,2020-08-13,"229 East Naples Street,Chula Vista,CA,91911",91911,"Kellogg (Karl H.) Elementary, Chula Vista Elementary",S,San Diego,Chula Vista Elementary,Kellogg (Karl H.) Elementary,TA,364.0
62,37680236037931,Chula Vista Elementary,Rice (Lilian J.) Elementary,91911-2098,http://schools.cvesd.org/schools/rice/,Elementary,32.619137,-117.07569,2019-02-13,"915 Fourth Avenue,Chula Vista,CA,91911",91911,"Rice (Lilian J.) Elementary, Chula Vista Elementary",S,San Diego,Chula Vista Elementary,Rice (Lilian J.) Elementary,TA,716.0
63,37680236037949,Chula Vista Elementary,Loma Verde Elementary,91911-5310,http://schools.cvesd.org/schools/lomaverde/pages/home,Elementary,32.601123,-117.04889,2019-02-13,"1450 Loma Lane,Chula Vista,CA,91911",91911,"Loma Verde Elementary, Chula Vista Elementary",S,San Diego,Chula Vista Elementary,Loma Verde Elementary,TA,573.0
64,37680236037964,Chula Vista Elementary,Finney (Myrtle S.) Elementary,92154-1799,http://schools.cvesd.org/schools/finney/,Elementary,32.584496,-117.04839,2020-08-13,"3950 Byrd Street,San Diego,CA,92154",92154,"Finney (Myrtle S.) Elementary, Chula Vista Elementary",S,San Diego,Chula Vista Elementary,Finney (Myrtle S.) Elementary,TA,402.0
65,37680236037972,Chula Vista Elementary,Palomar Elementary,91911-3799,http://schools.cvesd.org/schools/palomar/,Elementary,32.613776,-117.04282,2020-08-13,"300 East Palomar Street,Chula Vista,CA,91911",91911,"Palomar Elementary, Chula Vista Elementary",S,San Diego,Chula Vista Elementary,Palomar Elementary,TA,368.0
66,37680236037998,Chula Vista Elementary,Rosebank Elementary,91911-1997,http://schools.cvesd.org/schools/rosebank/,Elementary,32.649741,-117.07336,2020-08-13,"80 Flower Street,Chula Vista,CA,91911",91911,"Rosebank Elementary, Chula Vista Elementary",S,San Diego,Chula Vista Elementary,Rosebank Elementary,TA,651.0
67,37680236038004,Chula Vista Elementary,Silver Wing Elementary,92154-2422,http://schools.cvesd.org/schools/silverwing/,Elementary,32.578749,-117.05258,2019-12-05,"3730 Arey Drive,San Diego,CA,92154",92154,"Silver Wing Elementary, Chula Vista Elementary",S,San Diego,Chula Vista Elementary,Silver Wing Elementary,TA,458.0
68,37680236038012,Chula Vista Elementary,Sunnyside Elementary,91902-2209,http://schools.cvesd.org/schools/sunnyside/,Elementary,32.674619,-117.01545,2020-08-13,"5430 San Miguel Road,Bonita,CA,91902",91902,"Sunnyside Elementary, Chula Vista Elementary",S,San Diego,Chula Vista Elementary,Sunnyside Elementary,TA,453.0
69,37680236038020,Chula Vista Elementary,Valle Lindo Elementary,91911-5699,http://schools.cvesd.org/schools/vallelindo/,Elementary,32.604937,-117.03275,2020-08-12,"1515 Oleander Avenue,Chula Vista,CA,91911",91911,"Valle Lindo Elementary, Chula Vista Elementary",S,San Diego,Chula Vista Elementary,Valle Lindo Elementary,TA,477.0
70,37680236038038,Chula Vista Elementary,Valley Vista Elementary,91902-1139,http://schools.cvesd.org/schools/valleyvista/,Elementary,32.659676,-117.04907,2019-02-13,"3724 Valley Vista Way,Bonita,CA,91902",91902,"Valley Vista Elementary, Chula Vista Elementary",S,San Diego,Chula Vista Elementary,Valley Vista Elementary,TA,621.0
71,37680236038046,Chula Vista Elementary,Vista Square Elementary,91910-3604,http://schools.cvesd.org/schools/vistasquare/,Elementary,32.635041,-117.08832,2020-08-13,"540 G Street,Chula Vista,CA,91910",91910,"Vista Square Elementary, Chula Vista Elementary",S,San Diego,Chula Vista Elementary,Vista Square Elementary,TA,777.0
72,37680236066971,Chula Vista Elementary,Parkview Elementary,91911-3826,http://schools.cvesd.org/schools/parkview/,Elementary,32.612989,-117.03115,2020-08-13,"575 Juniper Street,Chula Vista,CA,91911",91911,"Parkview Elementary, Chula Vista Elementary",S,San Diego,Chula Vista Elementary,Parkview Elementary,TA,399.0
73,37680236069090,Chula Vista Elementary,Juarez-Lincoln Elementary,92154-2599,http://schools.cvesd.org/schools/juarezlincoln/,Elementary,32.58072,-117.04543,2020-08-13,"849 Twining Avenue,San Diego,CA,92154",92154,"Juarez-Lincoln Elementary, Chula Vista Elementary",S,San Diego,Chula Vista Elementary,Juarez-Lincoln Elementary,TA,596.0
74,37680236070825,Chula Vista Elementary,Los Altos Elementary,92154-3731,http://schools.cvesd.org/schools/losaltos/,Elementary,32.572654,-117.04889,2019-02-13,"1332 Kenalan Drive,San Diego,CA,92154",92154,"Los Altos Elementary, Chula Vista Elementary",S,San Diego,Chula Vista Elementary,Los Altos Elementary,TA,353.0
75,37680236095020,Chula Vista Elementary,Tiffany (Burton C.) Elementary,91913-2612,http://schools.cvesd.org/schools/tiffany/,Elementary,32.64483,-116.99102,2020-08-13,"1691 Elmhurst Street,Chula Vista,CA,91913",91913,"Tiffany (Burton C.) Elementary, Chula Vista Elementary",S,San Diego,Chula Vista Elementary,Tiffany (Burton C.) Elementary,TA,531.0
76,37680236095038,Chula Vista Elementary,Otay Elementary,91911-5801,http://schools.cvesd.org/schools/otay/,Elementary,32.595806,-117.05804,2020-08-13,"1651 Albany Avenue,Chula Vista,CA,91911",91911,"Otay Elementary, Chula Vista Elementary",S,San Diego,Chula Vista Elementary,Otay Elementary,TA,619.0
77,37680236107775,Chula Vista Elementary,Chula Vista Hills Elementary,91910-7133,http://schools.cvesd.org/schools/chulavistahills/,Elementary,32.636251,-117.00246,2020-08-13,"980 Buena Vista Way,Chula Vista,CA,91910",91910,"Chula Vista Hills Elementary, Chula Vista Elementary",S,San Diego,Chula Vista Elementary,Chula Vista Hills Elementary,TA,575.0
78,37680236108492,Chula Vista Elementary,EastLake Elementary,91913-1263,http://schools.cvesd.org/schools/eastlake/,Elementary,32.657494,-116.98515,2019-02-13,"1955 Hillside Drive,Chula Vista,CA,91913",91913,"EastLake Elementary, Chula Vista Elementary",S,San Diego,Chula Vista Elementary,EastLake Elementary,TA,596.0
79,37680236109771,Chula Vista Elementary,Clear View,91910-7400,http://schools.cvesd.org/schools/clearview/,Elementary,32.644805,-117.04506,2019-06-25,"455 Windrose Way,Chula Vista,CA,91910",91910,"Clear View, Chula Vista Elementary",S,San Diego,Chula Vista Elementary,Clear View,TA,541.0
80,37680236113021,Chula Vista Elementary,Olympic View Elementary,91915-2127,http://schools.cvesd.org/schools/olympicview/,Elementary,32.63572,-116.96342,2020-08-13,"1220 South Greensview Drive,Chula Vista,CA,91915",91915,"Olympic View Elementary, Chula Vista Elementary",S,San Diego,Chula Vista Elementary,Olympic View Elementary,TA,782.0
81,37680236115646,Chula Vista Elementary,Casillas (Joseph) Elementary,91910-7164,http://schools.cvesd.org/schools/casillas/,Elementary,32.630446,-117.00915,2020-08-13,"1130 East J Street,Chula Vista,CA,91910",91910,"Casillas (Joseph) Elementary, Chula Vista Elementary",S,San Diego,Chula Vista Elementary,Casillas (Joseph) Elementary,TA,489.0
82,37680236116396,Chula Vista Elementary,Marshall (Thurgood) Elementary,91914-3537,http://schools.cvesd.org/schools/marshall/,Elementary,32.659064,-116.9682,2020-08-13,"2295 MacKenzie Creek Road,Chula Vista,CA,91914",91914,"Marshall (Thurgood) Elementary, Chula Vista Elementary",S,San Diego,Chula Vista Elementary,Marshall (Thurgood) Elementary,TA,691.0
